author_name,reviewer_name,commit_id,commit_message,email
John Doe,Alice Smith,75eac2a,feat: Add new feature,johndoe@example.com
Alice Smith,John Doe,9f0dc64,fix: Fix bug in feature,alicesmith@example.com
Mark Thompson,Jane Johnson,4a1b8d9,refactor: Refactor code,markthompson@example.com
John Doe,Alice Smith,98dfc5a,feat: Implement login functionality,johndoe@example.com
Jane Johnson,Mark Thompson,d293d8f,feat: Add validation to form,janejohnson@example.com
Mark Thompson,Jane Johnson,9d36fb2,docs: Update API documentation,markthompson@example.com
John Doe,Alice Smith,21b1ea7,refactor: Optimize database queries,johndoe@example.com
Alice Smith,John Doe,7b82d4e,test: Add unit tests for authentication,alicesmith@example.com
Jane Johnson,Mark Thompson,3cf1e6a,feat: Implement user profile page,janejohnson@example.com
Mark Thompson,Jane Johnson,a8dc132,fix: Handle error in user profile,markthompson@example.com
John Doe,Alice Smith,64b7e8f,docs: Update README file,johndoe@example.com
Alice Smith,John Doe,8f6491b,refactor: Restructure project folders,alicesmith@example.com
Jane Johnson,Mark Thompson,1b27648,feat: Add email notification,janejohnson@example.com
Mark Thompson,Jane Johnson,504f71d,test: Add integration tests for registration,markthompson@example.com
John Doe,Alice Smith,d1055e3,fix: Resolve CSS conflicts,johndoe@example.com
Alice Smith,John Doe,23f50b7,docs: Add code examples to documentation,alicesmith@example.com
Jane Johnson,Mark Thompson,b8e76dc,refactor: Improve code readability,janejohnson@example.com
Mark Thompson,Jane Johnson,9c4823e,feat: Implement search functionality,markthompson@example.com
John Doe,Alice Smith,2f15dcb,fix: Handle null values in search,johndoe@example.com
Alice Smith,John Doe,7c8f542,docs: Update installation guide,alicesmith@example.com
Jane Johnson,Mark Thompson,ccf1a9e,refactor: Extract common functions,janejohnson@example.com
Mark Thompson,Jane Johnson,3d88ed4,test: Add performance tests,markthompson@example.com
John Doe,Alice Smith,5e4c2f9,feat: Add pagination to results,johndoe@example.com
Alice Smith,John Doe,92a79cd,fix: Handle empty result set,alicesmith@example.com
Jane Johnson,Mark Thompson,1b3c95e,docs: Update usage examples,janejohnson@example.com
Mark Thompson,Jane Johnson,d776942,refactor: Simplify code logic,markthompson@example.com
John Doe,Alice Smith,3f68e13,test: Add unit tests for pagination,johndoe@example.com
Jane Johnson,Mark Thompson,41d2a07,fix: Handle file size limit,janejohnson@example.com
Mark Thompson,Jane Johnson,8169e3c,docs: Update API endpoints,markthompson@example.com
Alice Smith,John Doe,9dcb372,feat: Add password reset functionality,alicesmith@example.com
Mark Thompson,Jane Johnson,3b2ec98,test: Add integration tests for file upload,markthompson@example.com
John Doe,Alice Smith,c9a834f,docs: Update license information,johndoe@example.com
Alice Smith,John Doe,f7e42e1,refactor: Rename variables for clarity,alicesmith@example.com
Jane Johnson,Mark Thompson,1ab2cd3,feat: Implement caching mechanism,janejohnson@example.com
Mark Thompson,Jane Johnson,4de5fg6,fix: Handle cache expiration,markthompson@example.com
John Doe,Alice Smith,7hi8j9k,docs: Update contribution guidelines,johndoe@example.com
Alice Smith,John Doe,l1m2n3o,refactor: Optimize database queries,alicesmith@example.com
Jane Johnson,Mark Thompson,4p5q6r7,feat: Add login history feature,janejohnson@example.com
Mark Thompson,Jane Johnson,s8t9u0v,fix: Handle session timeouts,markthompson@example.com
John Doe,Alice Smith,w1x2y3z,docs: Update API documentation,johndoe@example.com
Alice Smith,John Doe,d23e45f,refactor: Simplify code logic,alicesmith@example.com
Jane Johnson,Mark Thompson,67890ab,feat: Implement user settings page,janejohnson@example.com
Mark Thompson,Jane Johnson,c12d34e,fix: Handle error in user settings,markthompson@example.com
Alice Smith,John Doe,i90j12k,refactor: Extract reusable components,alicesmith@example.com
Mark Thompson,Jane Johnson,o78p90q,fix: Resolve issue with localization,markthompson@example.com
John Doe,Alice Smith,r12s34t,docs: Update API usage guide,johndoe@example.com
Alice Smith,John Doe,u56v78w,refactor: Optimize database queries,alicesmith@example.com
Jane Johnson,Mark Thompson,x90y12z,feat: Add reporting functionality,janejohnson@example.com
Mark Thompson,Jane Johnson,12345a6,fix: Handle reporting errors,markthompson@example.com
John Doe,Alice Smith,bcdefgh,docs: Update contribution guidelines,johndoe@example.com